level_id,order,name,client_name,Item,intro_description,budget_gold,budget_aura,success_text_1,success_text_2
L1_MILLER_BARN,1,Амбар мельника,Мельник Проспер,Замок,"Из амбара мельника Проспера пропадает мука. Магический замок уже стоит — он пускает только работников мельницы. Но кто именно входил и когда — неизвестно. Нужно добавить журнал доступа, чтобы найти виновного.",4,5,"Мельник Проспер потирает руки: журнал доступа помог поймать вора с поличным. Замок работает, мука цела. Добрая слава идёт впереди тебя!","Свиток чист, замок крепок, мука в сохранности. Мельник обещает печь пироги для всей деревни в честь мага, который навёл порядок."
L2_KESHA_CACHE,2,"Не Иннокентий, а Кеша",Иннокентий «Кеша»,Магический шар,"Старший писец Иннокентий просит превратить личный шар-ускоритель «Редиска» в общий сервис для всех отделов. Шар создавался без изоляции и без контроля роста — теперь каждый отдел хочет его использовать, и всё это одновременно.",6,3,Редиска теперь умеет разговаривать с каждым отделом по отдельности. Кеша облегчённо выдыхает — квартальные отчёты больше не будут ждать в очереди.,"Шар работает по-новому: каждый отдел получает свою долю, и никто не может захватить всю память. Кеша доволен — начальство наконец получило свои 'быстрые овощи'."
L3_GENNADY_LIGHTHOUSE,3,Указатель на перепутье,Геннадий (смотритель перекрёстка),Указатель,"На перекрёстке трёх торговых путей стоит безымянный указатель Геннадия. Посланники его не находят, узлы никто не проверяет, а маршруты никем не закреплены. Можно поставить алгоритмы — или договориться с посланниками. Каждый путь требует своего.",17,5,"Геннадий глядит на перекрёсток. Посланники расходятся по дорожкам сами — Весы делают своё дело, Сердцебиение следит за узлами. «Четыре детали, и всё работает. Хорошо.»","Геннадий разворачивает Карту Земель. «Каждый посланник знает свой путь заранее. Дорого — но надёжно, и ни одного лишнего эффекта.»"
L4_ANASTASIA_GOLDEN,4,Золотой путь Анастасии,Анастасия (платформенная команда),Шаблон,"Анастасия строит платформу: единый шаблон для новых сервисов её команды. Сервисы появляются без TLS, без логов и без healthcheck — каждый на своё усмотрение. Нужен «Золотой путь» — стандарт, который работает из коробки.",17,5,"Золотой путь проложен. Каждый новый сервис теперь появляется уже с TLS, логами и healthcheck. Анастасия видит сервисы как на ладони.",Шаблон работает. Команды больше не гадают — просто разворачивают по стандарту.
L5_KIRA_API,5,Автоматон-регистратор Киры,Кира Морозова (партнёрская платформа),Автоматон,"Кира Морозова строит единый API-шлюз для партнёров. Шлюз работает, но открыт всем, деплои хаотичны, а аудитного следа нет. Нужны авторизация, зрелый контур доставки (пайплайн, гейты, откат) и журнал доступа.",18,4,"Доступ закрыт, деплои воспроизводимы, аудит ведётся. Кира наконец-то спит спокойно.",Один партнёр попытался обойти авторизацию — журнал всё зафиксировал. Шлюз устоял.
L6_MARK_SHARDING,6,Голуби Марка,Марк Игоревич (архив),Механический голубь,"Марк Игоревич строит шардированный архив свитков. Три подсистемы: маршрутизация голубей, согласованная схема данных с миграциями, наблюдаемость. Не смешивай два закона маршрутизации без арбитра.",24,6,Голуби знают куда лететь. Каждый свиток попадает в правильный шард без переспросов. Марк доволен — архив вырос без хаоса.,Схема едина во всех шардах. Миграции проходят без сюрпризов. Летопись фиксирует каждый полёт.
L7_EDWARD_MULTIDC,7,Ковчеги Эдуарда,Эдуард (инфраструктура),Ковчег,"Эдуард строит резервные обелиски в двух локациях. Доступно семь контуров, но на площадку влезают только четыре. Нужно выбрать матрицы так, чтобы пережить падение дата-центра, проверить аварийное переключение и не захлебнуться на резерве.",30,9,Ковчеги запущены! Первый DC упал на 3 минуты — система даже не заметила. Второй принял трафик автоматически. Эдуард молча кивает — это значит 'отлично'.,Оба обелиска работают в синхронном режиме. Деплои происходят в обе локации без ручного вмешательства. Это и есть надёжность без героизма.
